{
  "$schema": "../../tooling/starters/starter.schema.json",
  "schemaVersion": 1,
  "id": "webapp-vanilla",
  "name": "Webapp vanilla",
  "version": "1.0.0",
  "category": "Projects",
  "level": "Foundation",
  "summary": "A browser application built with TypeScript and DOM APIs.",
  "outcome": "A reviewed prototype package with web application source (Vanilla TypeScript), ready for explicit dependency resolution and implementation.",
  "includes": [
    "Shared core in src/core with stable page data",
    "Web application entrypoint and local preview server",
    "Offline single-file prototype build (npm run build:prototype)",
    "Exact dependency pins with a root-only lock for explicit resolution"
  ],
  "implementation": [
    "Agree the prototype brief in the interview before any files are written",
    "Implement the agreed visual components and business actions",
    "Resolve dependencies explicitly, then typecheck, test and build every target"
  ],
  "tags": [
    "webapp",
    "browser",
    "vanilla"
  ],
  "inputs": [],
  "generator": {
    "kind": "project",
    "projectType": "webapp",
    "framework": "vanilla",
    "targets": [
      "webapp"
    ]
  },
  "files": [],
  "processes": [],
  "firstRun": [],
  "nextSteps": [
    "Review execution-prompt.md and source/README.md in the prepared package.",
    "In source/, run npm install, then npm run typecheck, npm test and npm run build.",
    "Run npm start for a local preview on 127.0.0.1:4173."
  ]
}
