{
  "$schema": "../../tooling/starters/starter.schema.json",
  "schemaVersion": 1,
  "id": "hybrid-angular",
  "name": "Hybrid with Angular",
  "version": "1.0.0",
  "category": "Projects",
  "level": "Advanced",
  "summary": "Plugin, webapp, website and CLI targets sharing project data and a standalone Angular browser UI.",
  "outcome": "A reviewed prototype package with Obsidian plugin + web application + static website + command-line application source (Angular), ready for explicit dependency resolution and implementation.",
  "includes": [
    "Shared core in src/core with stable page data",
    "Obsidian plugin entrypoint and manifest",
    "Web application entrypoint and local preview server",
    "Static website entrypoint and local preview server",
    "CLI entrypoint with --json output and exit code 2 on invalid input",
    "Offline single-file prototype build (npm run build:prototype)",
    "Exact dependency pins with a root-only lock for explicit resolution"
  ],
  "implementation": [
    "Agree the prototype brief in the interview before any files are written",
    "Implement the agreed visual components and business actions",
    "Resolve dependencies explicitly, then typecheck, test and build every target",
    "Qualify plugin behavior in a disposable Obsidian vault"
  ],
  "tags": [
    "hybrid",
    "multi-target",
    "angular"
  ],
  "inputs": [],
  "generator": {
    "kind": "project",
    "projectType": "hybrid",
    "framework": "angular",
    "targets": [
      "plugin",
      "webapp",
      "website",
      "cli"
    ],
    "angularPins": {
      "@angular/core": "22.0.0",
      "@angular/common": "22.0.0",
      "@angular/compiler": "22.0.0",
      "@angular/platform-browser": "22.0.0",
      "@angular/compiler-cli": "22.0.0",
      "rxjs": "7.8.2",
      "tslib": "2.8.1"
    }
  },
  "files": [],
  "processes": [],
  "firstRun": [],
  "nextSteps": [
    "Review execution-prompt.md and source/README.md in the prepared package.",
    "In source/, run npm install, then npm run typecheck, npm test and npm run build.",
    "Hybrid means separate host entrypoints over shared local code; it adds no cloud sync or desktop runtime."
  ]
}
