{
  "$schema": "../../tooling/starters/starter.schema.json",
  "schemaVersion": 1,
  "id": "webapp-angular",
  "name": "Angular webapp",
  "version": "1.0.0",
  "category": "Projects",
  "level": "Everyday",
  "summary": "A browser application with standalone Angular components; also the project-setup starter for an existing Git + Obsidian vault.",
  "outcome": "A reviewed prototype package with web application source (Angular), ready for explicit dependency resolution and implementation.",
  "includes": [
    "Shared core in src/core with stable page data",
    "Web application entrypoint and local preview server",
    "Offline single-file prototype build (npm run build:prototype)",
    "Exact dependency pins with a root-only lock for explicit resolution"
  ],
  "implementation": [
    "Agree the prototype brief in the interview before any files are written",
    "Implement the agreed visual components and business actions",
    "Resolve dependencies explicitly, then typecheck, test and build every target"
  ],
  "tags": [
    "webapp",
    "browser",
    "angular",
    "project-setup"
  ],
  "inputs": [],
  "generator": {
    "kind": "project",
    "projectType": "webapp",
    "framework": "angular",
    "targets": [
      "webapp"
    ],
    "angularPins": {
      "@angular/core": "22.0.0",
      "@angular/common": "22.0.0",
      "@angular/compiler": "22.0.0",
      "@angular/platform-browser": "22.0.0",
      "@angular/compiler-cli": "22.0.0",
      "rxjs": "7.8.2",
      "tslib": "2.8.1"
    }
  },
  "files": [],
  "processes": [],
  "firstRun": [],
  "nextSteps": [
    "Review execution-prompt.md and source/README.md in the prepared package.",
    "In source/, run npm install, then npm run typecheck, npm test and npm run build.",
    "Run npm start for a local preview on 127.0.0.1:4173.",
    "For an existing vault, node bin/app project-setup uses this starter and keeps first run separately approved."
  ]
}
